{
  "payload": {
    "schema_version": "1.0.0",
    "file_name": "release-notes.md",
    "sha256": "0a4f5e2ddb8eaa2bd443e34f9853c09039b2396188c251613a1c9a8741f30903",
    "size_bytes": 2209,
    "role": "release-notes",
    "key_id": "theorem-release-root",
    "signed_at": "2026-03-31T04:45:06Z"
  },
  "signer": "3d569d090330d1a66400cd2027cd5a950383902b9943a5602b53d82bcb186de1",
  "signature": "351c02abcc6afa0ad57dae74d426dfef6da6608341f5be80d6d71567fa9ae47fbff539a7b82bda27fa2b0fa8683a8fb53c7832ede3ad841a88e0797cf47fc80a",
  "algorithm": "ed25519"
}