{
  "payload": {
    "schema_version": "1.0.0",
    "file_name": "v0.6.3.json",
    "sha256": "343e83eefbc5aa77ac164d5d96acc0ca550ca4137f26cbdd07d6abb6565cb5d5",
    "size_bytes": 408,
    "role": "release-revocation-record",
    "key_id": "theorem-release-root",
    "signed_at": "2026-03-31T04:45:09Z"
  },
  "signer": "3d569d090330d1a66400cd2027cd5a950383902b9943a5602b53d82bcb186de1",
  "signature": "a69b8cd548f06ff07980b588a1906bc298392bc01b9adf7a604857eb8c809341ce1f15a7e276d515aed7ebaa1e027c6770fc9e63b9737b4a701c4dbb6861d006",
  "algorithm": "ed25519"
}