{
  "payload": {
    "schema_version": "1.0.0",
    "file_name": "manifest.json",
    "sha256": "a6143b6b3468ba8f41e5e0a2a945fc382ff034c667de8548a45d27b8760bc605",
    "size_bytes": 31088,
    "role": "release-manifest",
    "key_id": "theorem-release-root",
    "signed_at": "2026-03-31T04:45:04Z"
  },
  "signer": "3d569d090330d1a66400cd2027cd5a950383902b9943a5602b53d82bcb186de1",
  "signature": "365e75b54d1dbbc3749c3c59d0fbab25644864cba8e6f9d9d69542b42695ebcf5677812210751af81bb42994dad04bfe7110dfcf11da3d8abdf6d64f61091603",
  "algorithm": "ed25519"
}