{
  "payload": {
    "schema_version": "1.0.0",
    "file_name": "integrity.json",
    "sha256": "065e6708064fb35c373a9549f2d08369a2efd8bcdcc21c5b39e49eea4a15b0d2",
    "size_bytes": 8348,
    "role": "release-integrity",
    "key_id": "theorem-release-root",
    "signed_at": "2026-03-31T04:45:05Z"
  },
  "signer": "3d569d090330d1a66400cd2027cd5a950383902b9943a5602b53d82bcb186de1",
  "signature": "bf95690e8fa90fca88cc0deee5a17b91668d954968d8bfbe9749dc79492926a575c534c58240927ae86905cde43210fb3adbc83a64acf92a512e07d2b0d0660a",
  "algorithm": "ed25519"
}