{
  "payload": {
    "schema_version": "1.0.0",
    "file_name": "revocations.json",
    "sha256": "e791325bb11e535a5d47cc1cf290f282bfa2c20f743e7415429c8e9dbded5c7e",
    "size_bytes": 1384,
    "role": "release-revocation-ledger",
    "key_id": "theorem-release-root",
    "signed_at": "2026-03-26T21:36:00Z"
  },
  "signer": "3d569d090330d1a66400cd2027cd5a950383902b9943a5602b53d82bcb186de1",
  "signature": "14f885f1610d4854a543d08c6bbb69f4f0cb1147d6f3adffeaebdfae2e44d5ef09faddf67cf10a3d9875fc22eaf050aae6399d88a9f5061a74f3452956765408",
  "algorithm": "ed25519"
}